{
  "id": "slack-beta-program",
  "schemaVersion": "2.0",
  "provider": "Slack",
  "title": "Slack Beta Program",
  "aliases": [],
  "description": "Slack Beta Program is an official application, prerelease, or invitation channel through which selected participants may test unreleased capabilities administered by Slack.",
  "canonicalUrl": "https://slack.com/help/articles/115004846068-Slack-beta-program",
  "urls": {
    "providerUrl": null,
    "programUrl": null,
    "applicationUrl": null,
    "evidenceUrls": [
      {
        "type": "overview",
        "url": "https://slack.com/help/articles/115004846068-Slack-beta-program",
        "checkedAt": "2026-07-18T00:00:00.000Z",
        "claim": "Legacy source used for the published v1 record."
      }
    ]
  },
  "classification": {
    "resourceType": "resource",
    "primaryCategory": "early-access",
    "subcategories": [
      "private-betas",
      "waitlists"
    ],
    "topics": [
      "private-beta",
      "application"
    ],
    "audiences": [],
    "organizationStages": [],
    "benefitTypes": [],
    "reviewState": "needs-human-review",
    "defaultSearchEligible": false
  },
  "geography": {
    "global": null,
    "remote": null,
    "countries": [],
    "excludedCountries": [],
    "physicalLocations": [],
    "residencyRequired": null,
    "languages": []
  },
  "availability": {
    "status": "unconfirmed",
    "statusReason": "Excluded from default search by scope decision 'normal-beta-preview-channels': Normal public beta, insider, and preview channels are product release mechanisms rather than opportunities by default.",
    "opensAt": null,
    "closesAt": null,
    "deadlineType": "unknown",
    "applicationCycle": null,
    "nextExpectedOpening": null
  },
  "costAndBenefit": {
    "cost": null,
    "benefits": [],
    "currency": null,
    "amount": null,
    "maximumAmount": null,
    "benefitSummary": "Potential invitation to private testing, direct product feedback, and prerelease feature access"
  },
  "eligibility": {
    "summary": "Access depends on the current program, account, device, geography, capacity, confidentiality, and testing requirements; preview features may be unstable.",
    "studentLevels": [],
    "organizationTypes": [],
    "companyStages": [],
    "ageRestrictions": null,
    "incorporationRequired": null,
    "nonprofitStatusRequired": null,
    "openSourceRequired": null,
    "researchAffiliationRequired": null
  },
  "reviewProvenance": {
    "reviewedAt": "2026-07-18T00:00:00.000Z",
    "reviewMethod": "legacy-record-migration",
    "reviewerReference": null,
    "claimsChecked": [],
    "nextReviewAt": null,
    "sourceFetchedAt": null,
    "sourceHash": null,
    "confidence": null,
    "importSource": "legacy-maintainer-record",
    "extractorVersion": null
  },
  "changeHistory": {
    "createdAt": null,
    "updatedAt": "2026-07-23T00:00:00.000Z",
    "previousIds": [],
    "supersedes": [],
    "supersededBy": [],
    "tombstone": false,
    "removalReason": "Default-search exclusion (ordinary-preview-channel); record retained as resource."
  },
  "sponsorship": {
    "sponsored": false,
    "sponsorshipType": null,
    "sponsorshipDisclosure": null,
    "featuredReason": null,
    "featureExpiresAt": null
  },
  "migration": {
    "fromSchemaVersion": "1",
    "legacyStatus": "limited",
    "legacyRegions": [
      "Global"
    ],
    "unresolvedFields": [
      "urls.providerUrl",
      "urls.programUrl",
      "urls.applicationUrl",
      "geography.global",
      "geography.remote",
      "geography.countries",
      "geography.residencyRequired",
      "availability.deadlineType",
      "reviewProvenance.reviewerReference"
    ]
  }
}
