{
  "id": "google-developer-groups",
  "schemaVersion": "2.0",
  "provider": "Google for Developers",
  "title": "Google Developer Groups",
  "aliases": [],
  "description": "Google Developer Groups is an official technical community with local or online groups, knowledge sharing, and access to experienced practitioners administered by Google for Developers.",
  "canonicalUrl": "https://developers.google.com/community/gdg",
  "urls": {
    "providerUrl": null,
    "programUrl": null,
    "applicationUrl": null,
    "evidenceUrls": [
      {
        "type": "overview",
        "url": "https://developers.google.com/community/gdg",
        "checkedAt": "2026-07-18T00:00:00.000Z",
        "claim": "Legacy source used for the published v1 record."
      }
    ]
  },
  "classification": {
    "resourceType": "community",
    "primaryCategory": "mentorship-community",
    "subcategories": [
      "technical-communities",
      "peer-communities",
      "expert-networks"
    ],
    "topics": [
      "developers",
      "technical-community"
    ],
    "audiences": [],
    "organizationStages": [],
    "benefitTypes": [
      "network-access"
    ],
    "reviewState": "needs-human-review",
    "defaultSearchEligible": false
  },
  "geography": {
    "global": null,
    "remote": null,
    "countries": [],
    "excludedCountries": [],
    "physicalLocations": [],
    "residencyRequired": null,
    "languages": []
  },
  "availability": {
    "status": "unconfirmed",
    "statusReason": "Excluded from default search by scope decision 'generic-communities': General product, coworking, accountability, and founder communities without a distinct selective or material program belong outside default opportunity results.",
    "opensAt": null,
    "closesAt": null,
    "deadlineType": "unknown",
    "applicationCycle": null,
    "nextExpectedOpening": null
  },
  "costAndBenefit": {
    "cost": null,
    "benefits": [
      {
        "type": "network-access",
        "summary": "Technical events, peer support, practitioner knowledge, and collaboration opportunities"
      }
    ],
    "currency": null,
    "amount": null,
    "maximumAmount": null,
    "benefitSummary": "Technical events, peer support, practitioner knowledge, and collaboration opportunities"
  },
  "eligibility": {
    "summary": "Participants must meet the current membership, age, location, profession, conduct, and program-specific requirements.",
    "studentLevels": [],
    "organizationTypes": [],
    "companyStages": [],
    "ageRestrictions": null,
    "incorporationRequired": null,
    "nonprofitStatusRequired": null,
    "openSourceRequired": null,
    "researchAffiliationRequired": null
  },
  "reviewProvenance": {
    "reviewedAt": "2026-07-18T00:00:00.000Z",
    "reviewMethod": "legacy-record-migration",
    "reviewerReference": null,
    "claimsChecked": [],
    "nextReviewAt": null,
    "sourceFetchedAt": null,
    "sourceHash": null,
    "confidence": null,
    "importSource": "legacy-maintainer-record",
    "extractorVersion": null
  },
  "changeHistory": {
    "createdAt": null,
    "updatedAt": "2026-07-23T00:00:00.000Z",
    "previousIds": [],
    "supersedes": [],
    "supersededBy": [],
    "tombstone": false,
    "removalReason": "Default-search exclusion (generic-membership); record retained as community."
  },
  "sponsorship": {
    "sponsored": false,
    "sponsorshipType": null,
    "sponsorshipDisclosure": null,
    "featuredReason": null,
    "featureExpiresAt": null
  },
  "migration": {
    "fromSchemaVersion": "1",
    "legacyStatus": "limited",
    "legacyRegions": [
      "Global"
    ],
    "unresolvedFields": [
      "urls.providerUrl",
      "urls.programUrl",
      "urls.applicationUrl",
      "geography.global",
      "geography.remote",
      "geography.countries",
      "geography.residencyRequired",
      "availability.deadlineType",
      "reviewProvenance.reviewerReference"
    ]
  }
}
