{
  "id": "github-student-pack-github-codespaces",
  "schemaVersion": "2.0",
  "provider": "GitHub Codespaces",
  "title": "GitHub Codespaces Student Developer Pack Offer",
  "aliases": [],
  "description": "Create a codespace to start developing in a secure, configurable, and dedicated development environment that works how and where you want it to.",
  "canonicalUrl": "https://education.github.com/pack#github-codespaces",
  "urls": {
    "providerUrl": null,
    "programUrl": null,
    "applicationUrl": null,
    "evidenceUrls": [
      {
        "type": "overview",
        "url": "https://education.github.com/pack#github-codespaces",
        "checkedAt": "2026-07-18T00:00:00.000Z",
        "claim": "Legacy source used for the published v1 record."
      }
    ]
  },
  "classification": {
    "resourceType": "benefit",
    "primaryCategory": "student-benefits",
    "subcategories": [
      "student-developer-packs"
    ],
    "topics": [
      "github-education",
      "students"
    ],
    "audiences": [],
    "organizationStages": [],
    "benefitTypes": [],
    "reviewState": "needs-human-review",
    "defaultSearchEligible": false
  },
  "geography": {
    "global": null,
    "remote": null,
    "countries": [],
    "excludedCountries": [],
    "physicalLocations": [],
    "residencyRequired": null,
    "languages": []
  },
  "availability": {
    "status": "unconfirmed",
    "statusReason": "Excluded from default search by scope decision 'duplicate-bundle-components': Individual AWS Activate and GitHub Student Developer Pack components duplicate a larger bundle and overwhelm default opportunity discovery.",
    "opensAt": null,
    "closesAt": null,
    "deadlineType": "unknown",
    "applicationCycle": null,
    "nextExpectedOpening": null
  },
  "costAndBenefit": {
    "cost": null,
    "benefits": [],
    "currency": null,
    "amount": null,
    "maximumAmount": null,
    "benefitSummary": "Free Pro level access to Codespaces to use anywhere in your account."
  },
  "eligibility": {
    "summary": "Verified students aged 13 or older who are approved for the GitHub Student Developer Pack; provider restrictions may also apply.",
    "studentLevels": [],
    "organizationTypes": [],
    "companyStages": [],
    "ageRestrictions": null,
    "incorporationRequired": null,
    "nonprofitStatusRequired": null,
    "openSourceRequired": null,
    "researchAffiliationRequired": null
  },
  "reviewProvenance": {
    "reviewedAt": "2026-07-18T00:00:00.000Z",
    "reviewMethod": "legacy-record-migration",
    "reviewerReference": null,
    "claimsChecked": [],
    "nextReviewAt": null,
    "sourceFetchedAt": null,
    "sourceHash": null,
    "confidence": null,
    "importSource": "legacy-maintainer-record",
    "extractorVersion": null
  },
  "changeHistory": {
    "createdAt": null,
    "updatedAt": "2026-07-23T00:00:00.000Z",
    "previousIds": [],
    "supersedes": [],
    "supersededBy": [
      "github-student-developer-pack"
    ],
    "tombstone": false,
    "removalReason": "Default-search exclusion (component-offer); record retained as benefit."
  },
  "sponsorship": {
    "sponsored": false,
    "sponsorshipType": null,
    "sponsorshipDisclosure": null,
    "featuredReason": null,
    "featureExpiresAt": null
  },
  "migration": {
    "fromSchemaVersion": "1",
    "legacyStatus": "limited",
    "legacyRegions": [
      "Global"
    ],
    "unresolvedFields": [
      "urls.providerUrl",
      "urls.programUrl",
      "urls.applicationUrl",
      "geography.global",
      "geography.remote",
      "geography.countries",
      "geography.residencyRequired",
      "availability.deadlineType",
      "reviewProvenance.reviewerReference"
    ]
  }
}
